<?xml version="1.0" encoding="UTF-8"?>
<xs:schema xmlns:xs="http://www.w3.org/2001/XMLSchema" elementFormDefault="qualified">
  <xs:element name="factura">
    <xs:complexType>
      <xs:sequence>
        <xs:element name="emision" type="xs:string"/><!--minOccurs="1" maxOccurs="1"-->
        
        <xs:element name="vendedor">
          <xs:complexType>
            <xs:sequence>
              <xs:element name="nombre" type="xs:string"/>
            </xs:sequence>
            <xs:attribute name="id" type="xs:string" use="required"/>
          </xs:complexType>
        </xs:element>
        
        <xs:element name="cliente">
        <xs:complexType>
            <xs:sequence>
              <xs:element name="nombre" type="xs:string"/>
          
              <xs:element name="direccion">
                <xs:complexType>
                  <xs:sequence>
                    <xs:element name="via" type="xs:string"/>
                    <xs:element name="cp" type="xs:integer"/>
                    <xs:element name="localidad" type="xs:string"/>
                    <xs:element name="provincia" type="xs:string"/>
                  </xs:sequence>
                </xs:complexType>
              </xs:element>
              
              <xs:element name="telefono" minOccurs="0" maxOccurs="unbounded">
                <xs:complexType>
                  <xs:attribute name="num" type="xs:string"/>
                </xs:complexType>
              </xs:element>
              
            </xs:sequence>
            <xs:attribute name="id" type="xs:string" use="required"/>
          </xs:complexType>
        </xs:element>
        
        <xs:element name="articulo" minOccurs="1" maxOccurs="unbounded">
          <xs:complexType>
            <xs:sequence>
              <xs:element name="denominacion" type="xs:string"/>
              <xs:element name="precio" type="xs:string"/>
              <xs:element name="cantidad" type="xs:string"/>
            </xs:sequence>
            <xs:attribute name="id" type="xs:string" use="required"/>
            <xs:attribute name="iva" type="xs:integer" use="required"/>
          </xs:complexType>
        </xs:element>

          <xs:element name="descuento" minOccurs="0" maxOccurs="1">
            <xs:simpleType>
              <xs:restriction base="xs:integer">
                <xs:minInclusive value="0"/>
                <xs:maxInclusive value="100"/>
              </xs:restriction>
            </xs:simpleType>
          </xs:element>
        
      </xs:sequence>
      <xs:attribute name="id" type="xs:string"/>
    </xs:complexType>
  </xs:element>
</xs:schema>
